2046,Presbitero Drywall Company Inc.,plea,False Statements,,Illinois - Northern District,United States,No,USA v. Presbitero et al,1:02-cr-00165,0,2004-02-02,2004-02-02,2004-02-02,,No,0,0,14000,0,36,107898,121898,,,,,,,,,,,,,,,,,,,,,,,,,,,,,,,2004,PACER,
2047,Prevention Physical Therapy Inc.,plea,Fraud - Health Care,,Michigan - Western District,United States,No,USA v. Prevention Physical Therapy Inc.,1:04-cr-00046,24,2004-07-21,2004-07-21,2004-02-25,,No,,,6000,,0,6344,12344,,,,,,,,,,,,,,,,,,,,,,,,,,,,,,,2004,PACER,
2048,Pride Forasol S.A.S.,plea,FCPA,,USDOJ - Criminal Division - Fraud Section,France,No,USA v. Pride Forasol S.A.S.,4:10-cr-00771,25,2010-12-07,2010-12-07,2010-11-04,,No,,,32625000,,36,,32625000,,,,,,,,,,,,,,,,,,,,,,,,,,,,,,,2010,PACER,
97,"Pride Int'l, Inc.",DP,FCPA,No,USDOJ - Criminal Division - Fraud Section,United States,No,,,,2010-11-04,,,,Yes,0,,32625000,,36,,32625000,Yes,"Yes; Assignment one or more senior officers to compliance, with reporting obligations",No,,,Written reports on compliance policies and procedures,Yes,,FCPA - anti-bribery and books and records,Disgorgement and prejudgment interest,"Yes; firm discovered violation during routine audit, voluntarily and timely disclosed misconduct, thorough investigation, voluntary comprehensive compliance program, cooperation, remedial measures.",Yes,"Yes; Less than half the bottom of guidelines range, $72.5M",,No,Yes; Periodic testing of compliance system to evaluate effectiveness,,No,No,No,Yes; SEC,Yes,"Yes; Undertook on its own remedial measures, including enhancing FCPA compliance program",No,23529718,,Securities and Exchange Commission (SEC),Yes,23529718,No,2010,,
2049,Pride Production Co Inc.,plea,Wildlife,,Louisiana - Western District,United States,No,USA v. Pride Production Co Inc,6:04-cr-60050,10,2004-08-27,2004-08-27,2004-08-27,,No,,2000,2500,,0,,4500,,,,,,,,,,,,,,,,,,,,,,,,,,,,,,,2004,PACER,
2050,Prima Asphalt Concrete Inc.,plea,Fraud - General,,New York - Eastern District,United States,No,USA v. Haney,2:05-cr-00924,220,2008-08-15,2008-08-15,2008-08-15,,No,,,0,,36,326343,326343,,,,,,,,,,,,,,,,,,,,,,,,,,,,,,,2008,PACER,
2051,Prime Airport Services Inc.,plea,Environmental,,Florida - Southern District,United States,No,USA v. Prime Airport Services Inc.,1:10-cr-20671,10,2010-10-22,2010-10-22,2010-10-22,,No,0,0,1000000,0,0,0,1000000,,,,,,,,,,,,,,,,,,,,,,,,,,,,,,,2010,PACER,
2052,Prime Care Services Inc.,plea,Fraud - General,,Michigan - Western District,United States,No,USA v. Prime Care Services et al,1:03-cr-00217,86,2004-06-16,2004-06-16,2004-02-10,,No,,,10000,,12,865645,875645,,,,,,,,,,,,,,,,,,,,,,,,,,,,,,,2004,PACER,
3054,"Prime Holdings International, Inc",DP,Fraud - General,No,California - Southern District,United States,,USA v. Iglesias et al,3:16-cr-00131,,2016-12-08,,,,No,,,0,0,,0,0,,,,,,,,,,,,,,,,,,,,,,,,,,,,,,,2016,PACER,
2053,Princess Cruise Lines,plea,Wildlife,,"Alaska,Montana",United States,No,USA v. Princess Cruise Lines,3:07-cr-00005,15,2007-02-06,2007-02-06,2007-01-25,,No,,,200000,,0,550000,750000,,,,,,,,,,,,,,,,,,,,,,,,,,,,,,,2007,PACER,
803,Privatbank Bellerive AG,NP,Fraud - Tax,Yes,USDOJ - Tax Division,Switzerland,Yes,,,,2015-07-21,,,,No,0,0,57000,0,48,0,57000,,,,,,,,,,,,,,,,,,,,,,,,,,,,,,,2015,USDOJ - Tax Division - Swiss Bank Program (see: https://www.justice.gov/tax/swiss-bank-program),
98,Privatbank IHAG Zurich AG,NP,Fraud - Tax,Yes,USDOJ - Tax Division,Switzerland,Yes,,,,2015-11-09,,,,No,0,0,7453000,0,48,0,7453000,,,,,,,,,,,,,,,,,,,,,,,,,,,,,,,2015,USDOJ - Tax Division - Swiss Bank Program (see: https://www.justice.gov/tax/swiss-bank-program),
808,Privatbank Reichmuth & Co.,NP,Fraud - Tax,Yes,USDOJ - Tax Division,Switzerland,Yes,,,,2015-08-03,,,,No,0,0,2592000,0,48,0,2592000,,,,,,,,,,,,,,,,,,,,,,,,,,,,,,,2015,USDOJ - Tax Division - Swiss Bank Program (see: https://www.justice.gov/tax/swiss-bank-program),
798,Privatbank Von Graffenried AG,NP,Fraud - Tax,Yes,USDOJ - Tax Division,Switzerland,Yes,,,,2015-06-25,,,,No,0,0,287000,0,48,0,287000,,,,,,,,,,,,,,,,,,,,,,,,,,,,,,,2015,USDOJ - Tax Division - Swiss Bank Program (see: https://www.justice.gov/tax/swiss-bank-program),
2054,"Pro Med Services, Inc.",plea,Fraud - Health Care,,Florida - Middle District,United States,No,USA v. Cifelli et al,8:03-cr-00410,,2004-11-23,,2003-09-30,,No,,,0,,0,1467,1467,,,,,,,,,,,,,,,,,,,,,,,,,,,,,,,2004,PACER,
2055,Processors Unlimited Operating Co.,plea,FDCA / Pharma,,Texas - Northern District,United States,No,USA v. Processors Unlimited,5:00-cr-00129,11,2001-04-27,2001-04-27,2000-12-29,,No,,,500000,,0,22221,522221,,,,,,,,,,,,,,,,,,,,,,,,,,,,,,,2001,PACER,
463,"Proclad International Pipelines, Ltd.",plea,Import / Export,,District of Columbia,United Kingdom,No,USA v. PROCLAD INTERNATIONAL PIPELINES LTD,1:07-cr-00276,16,2008-03-20,2008-03-20,2007-11-30,,No,,,100000,,60,,100000,,,,,,,,,,,,,,,,,,,,,,,,,,,,,,,2008,PACER,
2056,Professional Clinic Management Inc.,plea,Fraud - Health Care,,Texas - Eastern District,United States,No,USA v. Professional Clinic Management Inc.,5:07-cr-00008,14,2007-08-31,2007-08-31,2007-04-02,,No,,,0,,36,100000,100000,,,,,,,,,,,,,,,,,,,,,,,,,,,,,,,2007,PACER,
2057,Professional Mobile Cleaning Inc.,plea,Environmental,,"Georgia - Northern District,Tennessee - Eastern District,Tennessee - Western District",United States,No,USA v. Professional Mobile Cleaning Inc.,2:05-cr-20060,6,2005-03-02,2005-03-02,2005-03-01,,No,,,221000,,0,,221000,,,,,,,,,,,,,,,,,,,,,,,,,,,,,,,2005,PACER,
2660,"Programmer Resources International, Inc.",plea,Immigration,,Missouri - Eastern District,United States,No,"USA v. Programmer Resources International, Inc. et al",4:15-cr-00231,26,2015-08-13,2015-08-13,2015-05-14,,No,0,0,100000,0,24,0,100000,,,,,,,,,,,,,,,,,,,,,,,,,,,,,,,2015,PACER,
464,"Promold, Inc.",plea,Fraud - General,,New York - Western District,United States,No,USA v. Promold Inc.,6:06-cr-06133,7,2007-02-01,2007-02-01,2006-07-21,,No,,,0,,12,189174,189174,,,,,,,,,,,,,,,,,,,,,,,,,,,,,,,2007,PACER,
2058,Pronto Staffing,plea,Antitrust,,USDOJ - Antitrust Division,United States,No,USA v. Pronto Staffing Inc.et al,1:09-cr-00278,10,2009-05-05,2009-05-05,2009-05-05,,No,,,400000,,0,,400000,,,,,,,,,,,,,,,,,,,,,,,,,,,,,,,2009,PACER,
3112,Pros Inc .,plea,Food,,,United States,,USA v. Harvey et al,9:15-cr-80226,,2016-02-19,2016-02-19,,,No,,,7500,,12,,7500,,,,,,,,,,,,,,,,,,,,,,,,,,,,,,,2016,PACER,Plea agreement not available via PACER
2059,Prosthetic Orthotic & Pedorthic Associates Inc.,plea,False Statements,,Tennessee - Western District,United States,No,USA v. Prosthetic Orthotic & Pedorthic Associates Inc.,2:07-cr-20300,9,2007-10-09,2007-10-09,2007-09-26,,No,,,10000,,0,8109,18109,,,,,,,,,,,,,,,,,,,,,,,,,,,,,,,2007,PACER,
2060,Providence Funding Inc.,plea,Fraud - General,,Indiana - Northern District,United States,No,United States of America v. Canada et al,3:09-cr-00156,48,2010-12-09,2010-12-09,2010-12-09,,No,0,,0,0,0,3546418,3546418,,,,,,,,,,,,,,,,,,,,,,,,,,,,,,,2010,PACER,
465,"Provident Capital Indemnity, LTD",plea,Fraud - General,,"USDOJ,Virginia - Eastern District",United States,No,USA v. Provident Capital Indemnity LTD.,3:11-cr-00014,118,2012-09-06,2012-09-06,2012-04-18,,No,,,0,0,12,0,0,,,,,,,,,,,,,,,,,,,,,,,,,,,,,,,2012,PACER,
2061,Provident Energy Associates of Montana LLC,plea,Wildlife,,Montana,United States,No,USA v. Provident Energy Associates of Montana LLC.,4:10-mj-00019,19,2010-07-08,2010-07-08,2010-05-04,,No,,5000,15000,,18,,20000,,,,,,,,,,,,,,,,,,,,,,,,,,,,,,,2010,PACER,
2719,Prudential,DP,Fraud - Securities,No,New York - Southern District,United States,No,,,,1994-10-01,,,,No,,,,,,,0,,,,,,,,,,,,,,,,,,,,,,,,,,,,,,,1994,,
466,Prudential Equity Group,plea,False Statements,,Massachusetts,United States,No,,,0,2005-03-14,2005-03-14,,,No,,,0,,12,2000000,2000000,,,,,,,,,,,,,,,,,,,,,,,,,,,,,,,2005,PACER,
2527,"Prudential Equity Group, LLC",NP,Fraud - Securities,No,,United States,Yes,,,,2008-08-01,,,,Yes,0,,325000000,,5,,325000000,Yes,No,No,,,N/A; Not stated,No,Yes; SEC Settlement,Securities Fraud - Deceptive trading of mutual funds,,"Yes; undue harm of indictment to innocent individuals, including current employees and shareholders, remedial actions.",Yes,No,"$270,000,000 in SEC settlement to Fair Fund; additional $5,000,000 penalty to Commonwealth of Massachusetts",No,No,,No,No,,"Yes; SEC, Massachusetts Securities Division",Yes,"Yes; Notes ""remedial actions to date""",Yes,270000000,5000000,Securities and Exchange Commission (SEC); other - NASD; other - NYSE; other - NYAG; other - NJBS,No,275000000,No,2008,,
467,Publix Network Corp.,plea,Controlled substances / Drugs / Meth Act,,Connecticut,United States,No,USA v. Liebermann et al,3:02-cr-00055,105,2005-03-10,2005-03-10,2004-09-30,,No,,,0,,0,0,0,,,,,,,,,,,,,,,,,,,,,,,,,,,,,,,2005,PACER,
468,"Puck Technology, Inc.",plea,Antitrust,,Pennsylvania - Western District,United States,No,USA v. PUCK TECHNOLOGY INC.,2:08-cr-00359,31,2010-04-21,2010-04-21,2010-04-21,,No,,,60000,,60,90243,150243,,,,,,,,,,,,,,,,,,,,,,,,,,,,,,,2010,PACER,
2062,Puerto Rico Aqueduct and Sewer Authority,plea,Environmental,,"other gov't,Puerto Rico",United States,No,USA v. Puerto Rico Aqueduct and Sewer Authority,3:06-cr-00202,22,2007-04-24,2007-04-24,2006-07-06,,No,,,9000000,,60,0,9000000,,,,,,,,,,,,,,,,,,,,,,,,,,,,,,,2007,PACER,
2063,Pulmonary Analytic Laboratories,plea,False Statements,,Ohio - Southern District,United States,No,USA v. Beekman et al,3:00-cr-00095,58,2003-12-24,2003-12-24,2003-03-20,,No,,,0,,0,257306,257306,,,,,,,,,,,,,,,,,,,,,,,,,,,,,,,2003,PACER,No probation - defunt corporation
469,"Pumps Valves & Equipment, Inc.",plea,FDCA / Pharma,,USDOJ - Antitrust Division,United States,No,USA v. Pumps Valves,1:02-cr-00355,17,2003-05-30,2003-05-30,2002-05-31,,No,,,500000,,60,,500000,,,,,,,,,,,,,,,,,,,,,,,,,,,,,,,2003,PACER,"$160,000,000 civil fines"
470,"Purdue Frederick Co., Inc.",plea,Environmental,,Virginia - Western District,United States,No,USA v. The Purdue Frederick Company Inc.et al,1:07-cr-00029,79,2007-07-25,2007-07-25,2007-05-10,,No,,,50000,,60,1802713,1852713,,,,,,,,,,,,,,,,,,,,,,,,,,,,,,,2007,PACER,
721,Purdue Pharma,NP,FDCA / Pharma,No,Virginia - Western District,United States,No,,,,2007-05-01,,,,No,0,,500000,,72,,500000,Yes,No,No,False Claims Act actions,,N/A; But corporate integrity agreement with HHS,No,Yes; HHS-OIG corporate integrity agreement,Misbranding,,"Yes; compliance with plea agreement, HHS-OIG agreement.",Yes,No,"Pursuant to guilty plea: $500,000 fine; $3,087,277.60 to federal and state Medicaid, $20 million to Virginia Prescription Monitoring Program trust account; $5,300,000 to Virginia Medicaid Fraud Control Unit?s Program Income Fund; $276,100.000 forfeiture; $160 million civil settlement;",No,No,,No,No,Yes,Yes; HHS-OIG,No,No; None noted,No,160000000,,Dept. of Health & Human Services - Office of the Inspector General,Yes,160000000,No,2007,,
471,"Pyramid Chemical Sales Co., Inc.",plea,FDCA / Pharma,,Pennsylvania - Eastern District,United States,No,USA v. Udell et al,2:05-cr-00402,23,2006-02-17,2006-02-17,2005-09-14,,No,925,0,6790000,0,36,83008,6873008,,,,,,,,,,,,,,,,,,,,,,,,,,,,,,,2006,PACER,
2064,Pyrotek Special Effects Inc,plea,Other,,California - Central District,United States,No,USA v. Pyrotek Special Effects Inc,2:07-cr-00364,18,2007-09-21,2007-09-21,2007-09-04,,No,,,150000,,24,3534,153534,,,,,,,,,,,,,,,,,,,,,,,,,,,,,,,2007,PACER,
2065,Q-Med Corp.,plea,FDCA / Pharma,,Florida - Southern District,United States,No,USA v. Q-Med Corporation,0:05-cr-60063,14,2005-07-20,2005-07-20,2005-04-29,,No,,,10000,,12,,10000,,,,,,,,,,,,,,,,,,,,,,,,,,,,,,,2005,PACER,
2066,Qantas Airways Ltd.,plea,Antitrust,,USDOJ - Antitrust Division,United States,No,USA v. QANTAS AIRWAYS LIMITED,1:07-cr-00322,7,2008-01-14,2008-01-14,2008-01-14,,Yes,,,61000000,,0,,61000000,,,,,,,,,,,,,,,,,,,,,,,,,,,,,,,2008,PACER,
2067,Quality Auto Sales LLC,plea,Fraud - Accounting,,Washington - Western District,United States,No,"USA v. Quality Auto Sales, LLC",2:12-cr-00271,8,2013-02-01,2013-02-01,2012-09-17,,No,400,0,100000,0,12,0,100000,,,,,,,,,,,,,,,,,,,,,,,,,,,,,,,2013,PACER,
472,"Quality Formulation Laboratories, Inc.",plea,Other,,"New Jersey,USDOJ - Office of Consumer Litigation",United States,No,USA v. QUALITY FORMULATION LABORATORIES INC.,2:10-cr-00699,146,2011-12-06,2011-12-06,2011-12-06,,No,,,500000,,36,,500000,,,,,,,,,,,,,,,,,,,,,,,,,,,,,,,2011,PACER,
2661,"Quality Work Group, Inc.",plea,Environmental,,USDOJ - Environment and Natural Resources Division - Environmental Crimes Section,United States,No,"USA v. Quality Work Group, Inc.",1:14-cr-00395,11,2014-10-31,2014-10-31,2014-08-06,,No,,,243000,,12,,243000,,,,,,,,,,,,,,,,,,,,,,,,,,,,,,,2014,PACER,
473,Quality-Vet,plea,Controlled substances / Drugs / Meth Act,,USDOJ - Criminal Division (California - Southern District),Mexico,No,USA v. Denkall et al,3:05-cr-01629,175,2007-09-10,2007-09-10,2007-09-10,,No,,,0,0,0,0,0,,,,,,,,,,,,,,,,,,,,,,,,,,,,,,,2007,PACER,
2068,Queens Market LLC,plea,Food,,Missouri - Western District,United States,No,USA v. Anstine et al,4:06-cr-00296,58,2007-12-21,2007-12-21,2007-12-13,,No,0,,2000,0,0,0,2000,,,,,,,,,,,,,,,,,,,,,,,,,,,,,,,2007,PACER,
722,"Quest Diagnostics, Inc.",NP,FDCA / Pharma,No,"New York - Eastern District,USDOJ - Civil Division",United States,No,,,,2009-04-15,,,,Yes,0,,0,,,,0,,,,False Claims Act qui tam,45000000,Unknown,Unknown,Yes; HHS-OIG corporate integrity agreement,"Felony misbranding in violation of Food, Drug and Cosmetic Act",,.,Unknown,,$40 million + $262 million civil settlement to resolve False Claims Act allegation + $6.2 million to Medicare to resolve other civil claims,Unknown,,,,,Yes,Yes; HHS-OIG,,Unknown,Unknown,268200000,,Dept. of Health & Human Services - Office of Inspector General (separate Corporate Integrity agreement),,268200000,No,2009,FOIA request,
2069,Quick Transportation Inc.,plea,Environmental,,California - Eastern District,United States,No,USA v. Brady et al,2:01-cr-00533,15,2002-12-17,2002-12-17,2002-12-17,,No,0,,100000,0,36,0,100000,,,,,,,,,,,,,,,,,,,,,,,,,,,,,,,2002,PACER,
2070,R & D Holdings LLC,plea,FDCA / Pharma,,Idaho,United States,No,USA v. R & D Holdings LLC,1:11-cr-00233,21,2012-01-19,2012-01-19,2011-10-05,,No,,,21000,,36,0,21000,,,,,,,,,,,,,,,,,,,,,,,,,,,,,,,2012,PACER,
2071,R&D Metals and Chemicals Inc.,plea,Fraud - General,,Ohio - Southern District,United States,No,USA v. Doody et al,2:13-cr-00072,5,2013-12-31,2013-12-31,2013-03-26,,No,800,0,0,0,36,628444,628444,,,,,,,,,,,,,,,,,,,,,,,,,,,,,,,2013,PACER,
2662,R. Hirt Jr. Co.,plea,Other,,Michigan - Eastern District,United States,No,USA v. R Hirt Jr Co,2:00-cr-81076,4,2001-04-12,2001-04-12,2000-12-19,,No,,,50000,,1,140000,190000,,,,,,,,,,,,,,,,,,,,,,,,,,,,,,,2001,PACER,
474,"R.S. Duffy, Inc.",plea,Money Laundering,,Pennsylvania - Middle District,United States,No,USA v. R.S. Duffy et al,4:11-cr-00305,36,2012-03-19,2012-03-19,2011-11-01,,No,,,1500000,4900000,0,0,6400000,,,,,,,,,,,,,,,,,,,,,,,,,,,,,,,2012,PACER,
2072,R.W. Zant Co.,plea,Food,,USDOJ - Criminal Division,United States,No,USA v. Zant Company et al,2:02-cr-00016,43,2003-10-01,2003-10-01,2003-06-05,,No,,,100000,,12,,100000,,,,,,,,,,,,,,,,,,,,,,,,,,,,,,,2003,PACER,
723,RAE Systems,NP,FCPA,No,California - Northern District,United States,No,,,,2010-12-10,,,,Yes,0,,1700000,,36,,1700000,Yes,"Yes; Assignment one or more senior officers to compliance, with reporting obligations",No,,,"Compliance program, submit reports to DOJ; new internal controls; internal reporting mechanisms",Yes,,FCPA,,No,Unknown,No,"$1,700,000",No,Yes; Periodic review and testing,,No,No,No,Yes; SEC,Yes,"Yes; Notes ""extensive remedial efforts already undertaken""",No,1250000,0,None stated,Yes,1250000,No,2010,,
2073,RCA Oil and Gas LLC,plea,Environmental,,Ohio - Southern District,United States,No,USA v. Armstrong et al,2:12-cr-00243,17,2013-07-23,2013-07-23,2013-02-05,,No,400,0,5000,0,36,0,5000,,,,,,,,,,,,,,,,,,,,,,,,,,,,,,,2013,PACER,
2074,REO Spineline Inc.,plea,FDCA / Pharma,,West Virginia - Northern District,United States,No,USA v. REO Spineline Inc.,1:06-cr-00070,30,2007-01-11,2007-01-11,2006-08-07,,No,,,0,,36,,0,,,,,,,,,,,,,,,,,,,,,,,,,,,,,,,2007,PACER,
725,RFK Institute,NP,,No,California - Central District,United States,No,,,,2008-11-01,,,,No,0,,,,,,0,,,,,,Unknown,Unknown,,,,.,,,,,,,,,No,,,Unknown,,,,,,0,,2008,,
2884,RGV Warehouse Inc.,plea,Food,,"Colorado,Texas - Southern District",United States,No,USA v. RGV Warehouse Inc.,7:00-cr-00338,20,2000-12-10,2000-12-10,2000-08-18,,No,,,75000,,48,,75000,,,,,,,,,,,,,,,,,,,,,,,,,,,,,,,2000,PACER,
2075,RH International LLC,plea,Import / Export,,Florida - Middle District,United States,No,USA v. Hajian et al,8:12-cr-00177,48,2012-10-24,2012-10-24,2012-05-02,,No,,,0,,12,0,0,,,,,,,,,,,,,,,,,,,,,,,,,,,,,,,2012,PACER,
2076,RJL Sciences,plea,Fraud - General,,Massachusetts,United States,No,USA v. Liedtke et al,1:05-cr-10088,36,2008-10-29,2008-10-29,2005-03-29,,No,,,5000,,0,,5000,,,,,,,,,,,,,,,,,,,,,,,,,,,,,,,2008,PACER,
2885,"RK Shows, Inc.",plea,Bank Secrecy Act,,Iowa - Northern District,United States,No,"USA v. RK Shows, Inc",6:12-cr-02010,35,2012-09-18,2012-09-18,2012-09-18,,No,,,,,60,,0,,,,,,,,,,,,,,,,,,,,,,,,,,,,,,,2012,PACER,
2666,"ROBBINS & MYERS BELGIUM, S.A.",plea,FCPA,,"District of Columbia,USDOJ - National Security Division - Counterespionage Section",non - U.S.,No,"USA v. ROBBINS & MYERS BELGIUM, S.A.",1:14-cr-00192,13,2014-10-06,2014-10-06,2014-10-02,,No,1600,0,1000000,0,60,0,1000000,,,,,,,,,,,,,,,,,,,,,,,,,,,,,,,2014,PACER,
484,"RPI Coating, Inc.",plea,OSHA / Workplace Safety / Mine Safety,,Colorado,United States,No,USA v. Xcel Energy Inc. et al,1:09-cr-00389,345,2012-01-11,2012-01-11,2011-12-19,,No,,,100000,,60,,100000,,,,,,,,,,,,,,,,,,,,,,,,,,,,,,,2012,PACER,
2077,RS Design LLC,plea,Controlled substances / Drugs / Meth Act,,Missouri - Western District,United States,No,USA v. Shakur et al,4:09-cr-00224,666,2011-08-05,2011-08-05,2011-02-04,,No,,,2,,0,0,2,,,,,,,,,,,,,,,,,,,,,,,,,,,,,,,2011,PACER,
2078,RSV Inc.,plea,Environmental,,Ohio - Southern District,United States,No,USA v. Vukelic et al,2:00-cr-00070,69,2001-05-08,2001-05-08,2000-10-25,,No,0,,150000,0,36,0,150000,,,,,,,,,,,,,,,,,,,,,,,,,,,,,,,2001,PACER,
2079,RTF Industries Inc.,plea,Environmental,,Texas - Eastern District,United States,No,USA v. RTF Industries Inc et al,2:01-cr-00016,44,2003-06-25,2003-06-25,2003-02-20,,No,,,100000,,12,,100000,,,,,,,,,,,,,,,,,,,,,,,,,,,,,,,2003,PACER,
2080,RTS Services Inc.,plea,Money Laundering,,Texas - Northern District,United States,No,USA v. Sickler et al,4:00-cr-00194,202,2003-03-18,2003-03-18,2002-09-20,,No,,,0,,36,0,0,,,,,,,,,,,,,,,,,,,,,,,,,,,,,,,2003,PACER,
2081,RTW Rehabilitation Services Inc.,plea,Fraud - General,,West Virginia - Southern District,United States,No,United States of America v. RTW Rehabilitation Services Inc.,2:05-cr-00211,16,2006-06-23,2006-06-23,2006-03-16,,No,,,50000,,12,40000,90000,,,,,,,,,,,,,,,,,,,,,,,,,,,,,,,2006,PACER,
2082,Racing Services Inc.,plea,Gambling,,North Dakota,United States,No,USA v. Racing Services Inc et al,3:03-cr-00112,184,2007-03-06,2007-03-06,2005-07-20,,No,,,0,99013200,0,0,99013200,,,,,,,,,,,,,,,,,,,,,,,,,,,,,,,2007,PACER,
2886,Rack Shop,plea,Antitrust,,USDOJ - Antitrust Division,United States,No,USA v. Rack Shop (DE) Inc,3:99-cr-00182,20,2000-04-19,2000-04-19,1999-05-17,,No,,,750000,,,,750000,,,,,,,,,,,,,,,,,,,,,,,,,,,,,,,2000,PACER,
2083,Raders Run Mining LLC,plea,OSHA / Workplace Safety / Mine Safety,,West Virginia - Southern District,United States,No,USA v. Midland Trail et al,5:03-cr-00257,89,2004-12-23,2004-12-23,2004-10-13,,No,,,0,,12,,0,,,,,,,,,,,,,,,,,,,,,,,,,,,,,,,2004,PACER,
2084,Radford Alexander Corp.,plea,Environmental,,USDOJ - Public Corruption & Gov't Fraud Section (California - Central District),United States,No,USA v. Radford Alexander,2:00-cr-01252,62,2001-12-12,2001-12-12,2001-09-13,,No,,,25000,,12,,25000,,,,,,,,,,,,,,,,,,,,,,,,,,,,,,,2001,PACER,
475,"Radiators, Inc.",plea,Environmental,,"other gov't,Utah",United States,No,USA v. Radiators Inc,2:07-cr-00213,6,2007-04-06,2007-04-06,2007-04-06,,No,,,40000,,0,,40000,,,,,,,,,,,,,,,,,,,,,,,,,,,,,,,2007,PACER,
2085,Radley Run Country Club Inc.,plea,Immigration,,Pennsylvania - Eastern District,United States,No,USA v. BMR DEVELOPMENT LLC et a,2:10-cr-00745,58,2011-03-07,2011-03-07,2010-12-09,,No,,,27000,,0,0,27000,,,,,,,,,,,,,,,,,,,,,,,,,,,,,,,2011,PACER,
2086,Rae Vern Industries Inc.,plea,False Statements,,Ohio - Southern District,United States,No,USA v. Erickson et al,2:02-cr-00112,26,2003-12-17,2003-12-17,2003-02-03,,No,,,0,,36,166116,166116,,,,,,,,,,,,,,,,,,,,,,,,,,,,,,,2003,PACER,
2087,Rager Fertilizer Co.,plea,Environmental,,Ohio - Southern District,United States,No,USA v. Rager Fertilizer Co.,2:07-cr-00126,17,2008-04-16,2008-04-16,2007-06-01,,No,,,5000,,0,10000,15000,,,,,,,,,,,,,,,,,,,,,,,,,,,,,,,2008,PACER,
476,"Rainbow Coatings, Inc.",plea,Environmental,,"Michigan - Eastern District,USDOJ",United States,No,USA v. Rainbow Coatings Inc,2:01-cr-80865,2,2002-01-24,2002-01-24,2002-01-24,,No,,5000,5000,,0,,10000,,,,,,,,,,,,,,,,,,,,,,,,,,,,,,,2002,PACER,
99,Ralph Lauren Corp.,NP,FCPA,No,"USDOJ - Criminal Division - Fraud Section,Virginia - Eastern District",United States,No,,,,2013-04-22,,,,Yes,,,882000,,24,,882000,Yes,"Yes; Assignment one or more senior officers to compliance, with reporting obligations",No,,,High level commitment to compliance from directors and senior management; promulgation of a clearly articulated and visible corporate policy against FCPA violations; system of financial and accounting procedures designed to ensure fair and accurate books; periodic risk-based review; annual certifications of compliance with training requirement; effective system for internal reporting and investigation; disciplinary process; appropriate due dilligence with third parties where appropriate including anti-corruption in contracts; FCPA focus in mergers and acquisitions,Yes,,FCPA anti-bribery provisions,,Yes; extensive cooperation - internal investigation; voluntarily making employees available for interviews; voluntary document disclosures; world-wide risk assessments; early and extensive remedial efforts; agreement to provide annual reports to the DOJ.,Yes,No,"$882,000 to US Treasury",No,Yes; Annual report to government,SEC NPA,No,Yes; but company had already hired prior to agreement.,,,Yes,"Yes; Early and extensive remedial efforts, including extensive world-wide employee training on FCPA; enhanced company FCPA Policy, enhanced gift policy; terminating culpable employees and third party agenets; institututing whistleblower hotline; hiring designated corporate compliance attorney",No,,,,Yes,,No,2013,,
2088,Ralphs Grocery Co.,plea,Fraud - General,,"USDOJ - Criminal Division,USDOJ - Major Frauds Section (California - Central District)",United States,No,USA v. Ralphs Grocery Co,2:05-cr-01210,76,2006-11-27,2006-11-27,2006-06-30,,Yes,,,0,,36,50000000,50000000,,,,,,,,,,,,,,,,,,,,,,,,,,,,,,,2006,PACER,
2089,Ram & Raj Inc.,plea,Gambling,,North Carolina - Eastern District,United States,No,USA v. Ram & Raj Inc.,5:05-cr-00233,11,2006-05-24,2006-05-24,2005-09-26,,No,,,15000,,12,,15000,,,,,,,,,,,,,,,,,,,,,,,,,,,,,,,2006,PACER,
2090,Ram Enterprises Inc.,plea,Fraud - General,,USDOJ - Criminal Division (California - Central District),United States,No,USA v. Ram Enterprises Inc et al,2:02-cr-00809,120,2003-09-24,2003-09-24,2003-05-08,,No,,,24000,,60,10423,34423,,,,,,,,,,,,,,,,,,,,,,,,,,,,,,,2003,PACER,
2091,Ram Medical Inc.,plea,FDCA / Pharma,,New Jersey,United States,No,USA v. RAM MEDICAL INC.,2:11-mj-08206,14,2012-05-14,2012-05-14,2011-12-07,,No,0,,500000,0,36,72922,572922,,,,,,,,,,,,,,,,,,,,,,,,,,,,,,,2012,PACER,
2092,Ramallo Bros. Printing Inc.,plea,False Statements,,other gov't,United States,No,USA v. Ramallo Bros. Printing Inc.,3:07-cr-00449,5,2007-10-25,2007-10-25,2007-10-25,,No,,,750000,,48,,750000,,,,,,,,,,,,,,,,,,,,,,,,,,,,,,,2007,PACER,
2093,Raman Int'l Inc.,plea,Fraud - General,,USDOJ - Antitrust Division,United States,No,United States of America v. Chidiac et al,5:08-cr-00033,85,2009-02-02,2009-02-02,2008-06-03,,No,,,500000,,0,378193,878193,,,,,,,,,,,,,,,,,,,,,,,,,,,,,,,2009,PACER,
2094,Ramco Fabricators Inc.,plea,Environmental,,North Carolina - Middle District,United States,No,USA v. RAMCO FABRICATORS,1:04-cr-00343,8,2005-01-11,2005-01-11,2004-09-09,,No,,,25000,,24,,25000,,,,,,,,,,,,,,,,,,,,,,,,,,,,,,,2005,PACER,
3027,"Ramsey Properties, LP",plea,Environmental,,Texas - Eastern District,United States,No,USA v. KTX LTD,1:16-cr-00075,48,2016-10-13,2016-10-13,2016-10-12,,No,,,3300000,,0,,3300000,,,,,,,,,,,,,,,,,,,,,,,,,,,,,,,2016,PACER,
2095,"Ranbaxy USA, Inc.",plea,FDCA / Pharma,,Maryland,non - U.S.,No,"USA v. Ranbaxy USA, Inc.",1:13-cr-00238,7,2013-05-13,2013-05-13,2013-05-13,,No,2800,0,130000000,0,0,0,130000000,,,,,,,,,,,,,,,,,,,,,,,,,,,,,,,2013,PACER,
2096,Rancho Cold Storage Inc.,plea,Food,,USDOJ - Criminal Division,United States,No,USA v. Rancho Cold Storage,2:03-cr-00100,25,2004-02-04,2004-02-04,2003-06-16,,No,,,20000,,12,,20000,,,,,,,,,,,,,,,,,,,,,,,,,,,,,,,2004,PACER,
2887,Randys Travel Town Inc.,plea,Fraud - General,,Louisiana - Western District,United States,No,USA v. Randy's Travel Town,5:00-cr-50042,11,2000-11-01,2000-11-01,2000-07-20,,No,,,15000,,60,,15000,,,,,,,,,,,,,,,,,,,,,,,,,,,,,,,2000,PACER,
2097,Rapoca Energy Co.,plea,OSHA / Workplace Safety / Mine Safety,,Virginia - Western District,United States,No,USA v. Rapoca Energy Co et al,1:00-cr-00092,65,2001-09-17,2001-09-17,2001-03-23,,No,,,60000,,60,1938825,1998825,,,,,,,,,,,,,,,,,,,,,,,,,,,,,,,2001,PACER,
2098,Rast Construction Inc.,plea,Fraud - General,,Alabama - Northern District,United States,No,USA v. Swann et al,2:05-cr-00061,840,2007-04-02,2007-04-02,2007-04-02,,No,,,1702500,,60,,1702500,,,,,,,,,,,,,,,,,,,,,,,,,,,,,,,2007,PACER,
