345,"International Veneer Co., Inc.",plea,Other,,Virginia - Eastern District,United States,No,USA v. International Veneer Company Inc.,2:12-cr-00023,0,2012-03-01,,2012-03-01,,No,,,0,125000,0,0,125000,,,,,,,,,,,,,,,,,,,,,,,,,,,,,,,2012,PACER,
1598,Interordnance Inc.,plea,Other,,North Carolina - Western District,United States,No,USA v. Wiegand et al,3:05-cr-00321,13,2006-02-09,2006-02-09,2005-08-25,,No,,,10000,,0,0,10000,,,,,,,,,,,,,,,,,,,,,,,,,,,,,,,2006,PACER,
1599,Interstate Amusements Inc,plea,Gambling,,Delaware,United States,No,USA v. Interstate Amusement,1:03-cr-00056,21,2004-05-25,2004-05-25,2003-12-04,,No,,,142931,,0,0,142931,,,,,,,,,,,,,,,,,,,,,,,,,,,,,,,2004,PACER,
1600,Intertek Testing Services Environmental Laboratori,plea,Fraud - General,,Texas - Northern District,United States,No,USA v. Intertek Testing,3:01-cr-00318,10,2002-02-08,2002-02-08,2001-10-05,,Yes,8741000,,9000000,,42,,9000000,,,,,,,,,,,,,,,,,,,,,,,,,,,,,,,2002,PACER,
3033,"Intertrade Imports, Inc.",plea,FDCA / Pharma,,California - Central District,United States,No,"USA v. Halloween and Party Discounters, Inc.",2:14-cr-00641,54,2015-03-30,2015-03-30,2015-01-27,,No,,,5000,,12,,5000,,,,,,,,,,,,,,,,,,,,,,,,,,,,,,,2015,PACER,
346,"Intrex Helicopters, Inc.",plea,Other,,Washington - Western District,United States,No,USA v. Intrex Helicopters,2:01-cr-00249,5,2001-08-02,2001-08-02,2001-06-29,,No,,,1000,,12,28405,29405,,,,,,,,,,,,,,,,,,,,,,,,,,,,,,,2001,PACER,
1601,Intrinsic Inc.,plea,Environmental,,Louisiana - Middle District,United States,No,USA v. Intrinsic Inc.,3:04-cr-00181,17,2005-06-03,2005-06-03,2004-11-22,,No,,,25000,,,2500,27500,,,,,,,,,,,,,,,,,,,,,,,,,,,,,,,2005,PACER,
2612,"Investor Funding, Inc.",plea,Fraud - General,,Michigan - Eastern District,United States,No,"United States of America v. Investor Funding, Inc.",2:13-cr-20694,10,2014-09-10,2014-09-10,2013-11-20,,No,,,0,,60,4292721,4292721,,,,,,,,,,,,,,,,,,,,,,,,,,,,,,,2014,PACER,
2996,"Invex Group, LLC",plea,Other,,California - Southern District,United States,No,"USA v. Invex Group, LLC",3:14-cr-02194,,2016-01-21,2016-01-21,2016-01-20,,No,,,,500000,60,,500000,,,,,,,,,,,,,,,,,,,,,,,,,,,,,,,2016,PACER,
347,Ionia Management,plea,Act to Prevent Pollution from Ships,,Connecticut,Greece,No,USA v. Ionia Management S.A. et al,3:07-cr-00175,15,2007-12-18,2007-12-18,2007-09-06,,No,,,4900000,,24,,4900000,,,,,,,,,,,,,,,,,,,,,,,,,,,,,,,2007,PACER,
348,Ionia Management,plea,Environmental,,New York - Eastern District,Greece,No,USA v. Kostakis,1:02-cr-00530,75,2004-11-02,2004-11-02,2004-11-17,,No,,,150000,40973,36,,190973,,,,,,,,,,,,,,,,,,,,,,,,,,,,,,,2004,PACER,Fine directed to community service
1602,Irika Shipping S.A.,plea,Act to Prevent Pollution from Ships,,Maryland,Greece,No,USA v. Irika Shipping S.A.,1:10-cr-00372,19,2010-10-15,2010-10-15,2010-07-08,,No,,1000000,3000000,,60,,4000000,,,,,,,,,,,,,,,,,,,,,,,,,,,,,,,2010,PACER,
1603,Irish Inc.,plea,Fraud - General,,Ohio - Northern District,United States,No,USA v. Irish Inc.,1:01-cr-00326,14,2002-07-08,2002-07-08,2002-07-08,,No,,,10000,,0,,10000,,,,,,,,,,,,,,,,,,,,,,,,,,,,,,,2002,PACER,
1604,Irving Libertoff Inc.,plea,Antitrust,,New York - Southern District,United States,No,USA v. Penachio et al,1:00-cr-00583,102,2001-10-03,2001-10-03,2001-05-11,,No,,,4000000,,60,0,4000000,,,,,,,,,,,,,,,,,,,,,,,,,,,,,,,2001,PACER,
1605,Irving Materials Inc.,plea,Antitrust,,USDOJ - Antitrust Division,United States,No,"UNITED STATES OF AMERICA v. IRVING MATERIALS, INC.",,0,2005-06-29,2005-06-29,2005-06-29,,No,,,29200000,,0,,29200000,,,,,,,,,,,,,,,,,,,,,,,,,,,,,,,2005,Antitrust Division website,
349,"Ishihara Sangyo Kaisha, Ltd.",plea,Antitrust,,USDOJ - Antitrust Division,Japan,No,USA v. ISHIHARA KAISHA LTD et al,2:01-cr-00421,26,2003-02-05,2003-02-05,2001-08-24,,No,,,5000000,,0,,5000000,,,,,,,,,,,,,,,,,,,,,,,,,,,,,,,2003,PACER,
1606,Isis Society for Inspirational Studies Inc.,plea,Wildlife,,Oregon,United States,No,USA v. Isis Society For Inspirational Studies Inc,3:06-cr-00313,16,2007-01-08,2007-01-08,2006-08-02,,No,,,0,,24,60000,60000,,,,,,,,,,,,,,,,,,,,,,,,,,,,,,,2007,PACER,
695,Islamic Investment Co. of the Gulf (Bahamas) Ltd.,NP,Fraud - Tax,No,USDOJ - Tax Division,Bahamas,Yes,,,,2011-08-12,,,,No,22538000,,4508000,,18,22538000,27046000,Yes,No,No,,,,No,,Tax violations,,"Yes; cooperation, including facilitating cooperation with the government of Switzerland.",Yes; And a one-year extension of the term of the agreement can be imposed,,,No,No,,No,No,No,No,No,No; None cited,Yes,0,0,Dept. of the Treasury - Internal Revenue Service (IRS),Yes,0,No,2011,,
3022,Islamic Services of America,plea,Money Laundering,,Iowa - Northern District,United States,No,USA v. Aossey et al,1:14-cr-00138,240,2016-02-29,2016-02-29,2015-09-09,,No,,,,,0,,0,,,,,,,,,,,,,,,,,,,,,,,,,,,,,,,2016,PACER,Dissolved
350,"Island Fork Construction, Ltd.",plea,OSHA / Workplace Safety / Mine Safety,,West Virginia - Southern District,United States,No,USA v. Midland Trail et al,5:03-cr-00257,92,2004-12-23,2004-12-23,2004-10-13,,No,,,0,,12,,0,,,,,,,,,,,,,,,,,,,,,,,,,,,,,,,2004,PACER,
351,"Island Lath and Plaster, Inc.",plea,False Statements,,Massachusetts,United States,No,USA v. Island Lath and Plaster Inc.,1:08-cr-10351,10,2009-06-15,2009-06-15,2008-11-06,,No,,,65000,,12,,65000,,,,,,,,,,,,,,,,,,,,,,,,,,,,,,,2009,PACER,
2826,"Island Periodicals, LLC",plea,Antitrust,,USDOJ - Antitrust Division,United States,No,USA v. Rack Shop (DE) Inc,3:99-cr-00182,20,2000-04-19,2000-04-19,1999-05-17,,No,,,750000,,,,750000,,,,,,,,,,,,,,,,,,,,,,,,,,,,,,,2000,PACER,
1607,Ives Health Care Co. Inc.,plea,Fraud - General,,New York - Southern District,United States,No,USA v. Ives Health Com. Inc,1:01-cr-00691,0,2004-03-24,2004-03-24,2004-03-19,,No,0,,0,0,0,0,0,,,,,,,,,,,,,,,,,,,,,,,,,,,,,,,2004,PACER,
1608,J&N International Coatings Inc.,plea,Environmental,,Oklahoma - Western District,United States,No,United States of America v. Tiliakos et al,5:04-cr-00115,128,2005-10-13,2005-10-13,2005-05-05,,No,,,20000,,24,0,20000,,,,,,,,,,,,,,,,,,,,,,,,,,,,,,,2005,PACER,
1609,J&S Distribution & Trading Inc.,plea,False Statements,,Washington - Western District,United States,No,USA v. J & S Distr and Trdg,2:02-cr-00268,13,2002-10-29,2002-10-29,2002-08-20,,No,,,4000,,0,,4000,,,,,,,,,,,,,,,,,,,,,,,,,,,,,,,2002,PACER,
1610,J.D. Miller & Sons Trucking Inc.,plea,Fraud - General,,Florida - Middle District,United States,No,USA v. Blankenship et al,8:00-cr-00382,177,2001-09-20,2001-09-20,2001-08-29,,No,,,30000,,60,0,30000,,,,,,,,,,,,,,,,,,,,,,,,,,,,,,,2001,PACER,
1611,J.F.R. LLC,plea,Fraud - General,,"Georgia - Northern District,Georgia - Northern District (Economic Crime Section)",United States,No,USA v. Karimi,1:04-cr-00555,756,2008-07-29,2008-07-29,2008-07-28,,No,,,12000,,60,102898,114898,,,,,,,,,,,,,,,,,,,,,,,,,,,,,,,2008,PACER,
2956,JACAM Manufacturing LLC,plea,Environmental,,Kansas,United States,,"USA v. JACAM Manufacturing, LLC",6:15-cr-10173,15,2016-01-08,2016-01-08,2015-12-22,,No,,,1000000,,,,1000000,,,,,,,,,,,,,,,,,,,,,,,,,,,,,,,2016,PACER,
1612,JAT International Corp.,plea,Other,,Virginia - Eastern District,United States,No,USA v. JAT International Corp. et al,3:08-cr-00030,29,2008-06-16,2008-06-16,2008-06-16,,No,0,,0,0,36,0,0,,,,,,,,,,,,,,,,,,,,,,,,,,,,,,,2008,PACER,
2726,JB Oxford Holdings,NP,Fraud - Securities,No,California - Central District,United States,No,,,,2000-02-01,,,,No,,,,,,,0,,,,,,,,,,,,,,,,,,,,,,,,,,,,,,,2000,,
1613,JC Online Marketing LLC,plea,Other,,California - Central District,United States,No,USA v. JC Online Marketing LLC,2:07-cr-01109,11,2007-11-05,2007-11-05,2007-10-11,,No,,,23000,,0,0,23000,,,,,,,,,,,,,,,,,,,,,,,,,,,,,,,2007,PACER,
1614,JC Seifts & Co. Inc.,plea,Fraud - General,,New York - Northern District,United States,No,USA v. JC Seifts & Co. Inc.,1:08-cr-00621,7,2009-04-02,2009-04-02,2008-10-16,,No,,,0,,60,133382,133382,,,,,,,,,,,,,,,,,,,,,,,,,,,,,,,2009,PACER,
355,"JDMevolution, Inc.",plea,Import / Export,,California - Central District,United States,No,USA v. Tissera,8:08-cr-00300,75,2011-08-26,2011-08-26,2011-03-21,,No,,,0,,12,0,0,,,,,,,,,,,,,,,,,,,,,,,,,,,,,,,2011,PACER,
604,JGC,DP,FCPA,No,USDOJ - Criminal Division - Fraud Section,Japan,No,,,,2011-04-06,,,,Yes,0,,218800000,,24,,218800000,Yes,"Yes; Assignment one or more senior officers to compliance, with reporting obligations",No,,,"Including retaining corporate compliance consultant, new corporate compliance code, standard FCPA corporate compliance program: periodic testing of compliance code, standards, and procedures",Yes,No,FCPA,,"Yes; after initially declininc to cooperate, began to cooperate, remedial measures, impact on company of guilty plea.",Yes,Yes; 30% below bottom of guidelines range,,Yes,Yes; Periodic review and testing,,No,No,No,,Yes,Yes; Cites remedial measures: evaluating and enhancing its compliance program,No,0,0,,Yes,0,No,2011,,
1615,JMG Excavating Co.,plea,Fraud - General,,Pennsylvania - Eastern District,United States,No,USA v. JMG EXCAVATING CO.,2:06-cr-00134,8,2006-05-26,2006-05-26,2006-05-26,,No,,,0,,60,1227152,1227152,,,,,,,,,,,,,,,,,,,,,,,,,,,,,,,2006,PACER,
1616,JMHNJ LLC,plea,Other,,New Jersey,United States,No,USA v. JMHNJ L.L.C.,2:02-cr-00031,7,2002-07-31,2002-07-31,2002-01-16,,No,,,17500,,0,,17500,,,,,,,,,,,,,,,,,,,,,,,,,,,,,,,2002,PACER,
357,"JMJ Environmental, Inc.",plea,Antitrust,,USDOJ - Antitrust Division,United States,No,USA v. JMJ ENVIRONMENTAL Inc.et al,2:08-cr-00522,19,2011-04-12,2011-04-12,2008-07-23,,No,,,400000,,0,,400000,,,,,,,,,,,,,,,,,,,,,,,,,,,,,,,2011,PACER,
1617,JNE Trucking Co. Inc.,plea,False Statements,,California - Central District,United States,No,USA v. JNE TRUCKING COMPANY INC. et al,2:09-cr-00354,35,2010-02-04,2010-02-04,2009-07-02,,No,,,100000,,60,,100000,,,,,,,,,,,,,,,,,,,,,,,,,,,,,,,2010,PACER,
3139,JP Morgan Chase & Co,plea,Antitrust,,USDOJ - Antitrust Division (New York),United States,,USA v. JP Morgan Chase & Co.,3:15-cr-00079,,2017-01-10,2017-01-10,2015-05-20,,Yes,,,550000000,0,,0,550000000,,,,,,,,,,,,,,,,,,,,,,,,,,,,,,,2017,,
698,JPMorgan Chase & Co.,NP,Antitrust,No,USDOJ - Antitrust Division,United States,Yes,,,,2011-07-06,,,,Yes,0,,0,,24,,0,Yes,No,No,"In re Municipal Derivatives Antitrust Litigation, Docket No. 1:08-md-01950-VM; class action",44600000,"Agreed to implement measures to strengthen board oversight and compliance risk management programs relating to certain types of transactions.""",Yes,No,Antitrust violations,,"Yes; admission, cooperation, payments, remedial efforts.",Yes,No,"$228,000,000 to federal and state agencies - $50.0 million to the IRS; $51.2 million to the SEC; $35.0 million to the OCC; and $75.0 million to the State Attorneys General",No,No,,No,No,Yes,"Yes; IRS, SEC, OCC, State AG's",No,No; None cited,No,,228000000,Dept. of the Treasury - Internal Revenue Service (IRS); Dept. of the Treasury - Office of the Comptroller of the Currency (OCC); Federal Reserve Board; Securities and Exchange Commission (SEC),No,228000000,No,2011,,
757,"JPMorgan Chase Bank, N.A.",DP,Bank Secrecy Act,No,New York - Southern District,United States,Yes,,,,2014-01-06,,,,Yes,0,0,0,1700000000,24,0,1700000000,,,,,,,,,,,,,,,,,,,,,,,,,,,,,,,2014,,
3034,JPMorgan Securities (Asia Pacific) Limited,NP,FCPA,No,USDOJ - Criminal Division - Fraud Section|New York - Eastern District,United States,Yes,,,,2016-11-17,,,,Yes,,,72000000,0,,0,72000000,,,,,,,,,,,,,,,,,,,,,,,,,,,,,,,2016,DOJ (see: https://www.justice.gov/opa/press-release/file/911206/download),
1618,JT Eaton & Co. Inc.,plea,False Statements,,Ohio - Northern District,United States,No,USA v. Baker et al,5:01-cr-00346,22,2001-11-07,2001-11-07,2001-08-16,,No,,,100000,,12,0,100000,,,,,,,,,,,,,,,,,,,,,,,,,,,,,,,2001,PACER,
2943,JTEKT Corp.,plea,Antitrust,,USDOJ - Antitrust Division (Chicago),Japan,,USA v. JTEKT Corporation,1:13-cr-00104,24,2014-07-09,2014-07-09,2013-09-26,,No,,,103270,,,,103270,,,,,,,,,,,,,,,,,,,,,,,,,,,,,,,2014,PACER,
1619,JUD LLC,plea,Controlled substances / Drugs / Meth Act,,"Missouri - Western District,Missouri - Western District",United States,No,USA v. Chavez et al,4:07-cr-00115,472,2009-10-29,2009-10-29,2009-12-10,,No,,,5000,,0,0,5000,,,,,,,,,,,,,,,,,,,,,,,,,,,,,,,2009,PACER,
1620,Jab America Inc.,plea,Environmental,,Florida - Southern District,United States,No,USA v. Jab America Inc.,0:04-cr-60255,8,2004-12-30,2004-12-30,2004-12-22,,No,,,0,,12,,0,,,,,,,,,,,,,,,,,,,,,,,,,,,,,,,2004,PACER,
603,Jackson Country Club,DP,Immigration,No,Mississippi - Southern District,United States,No,,,,2008-02-06,,,,No,0,,214500,,24,,214500,Yes,Yes; Compliance officer,"Yes; External auditing, or trained employee",,,"Implementation of ""best practices"" as to completion of I-9 forms and social security number verification under IMAGE, reports to ICE",Yes,,Immigration violations,,"Yes; acknowledging responsibility, civil settlements, cooperation.","Yes; Upon written notice, and with 14 day cure period.",No,"$214,500.00",No,No,,No,No,No,No,No,No,Yes,0,0,"None; but uses standards from U.S. Dept. of Homeland Security; Immigration and Customs Enforcement (""IMAGE"")",Yes,0,"Yes; Free public workshop held quarterly to train employers re: how to complete I-9 forms, adhere to the best IMAGE practices, etc.",2008,,
1621,"Jacktrade, LLC",plea,Other,,Nevada,United States,No,"USA v. Jacktrade, LLC.",2:12-cr-00401,7,2013-03-27,2013-03-27,2012-11-19,,No,400,0,0,2057408,0,0,2057408,,,,,,,,,,,,,,,,,,,,,,,,,,,,,,,2013,PACER,
1622,Jacobson Produce Inc.,plea,Antitrust,,New York - Southern District,United States,No,USA v. Jacobson et al,1:01-cr-00925,9,2001-12-17,2001-12-17,2002-09-27,,No,0,0,148000,0,36,148000,296000,,,,,,,,,,,,,,,,,,,,,,,,,,,,,,,2001,PACER,
1623,Jai Gopal Inc.,plea,Controlled substances / Drugs / Meth Act,,Georgia - Northern District,United States,No,USA v. Jai Gopal Inc.,4:06-cr-00031,24,2006-08-21,2006-08-21,2006-04-27,,No,,,30000,,36,0,30000,,,,,,,,,,,,,,,,,,,,,,,,,,,,,,,2006,PACER,
353,"Jalaram, Inc.",plea,Money Laundering,,"USDOJ - Criminal Division - Asset Forfeiture & Money Laundering Section,West Virginia - Northern District",United States,No,USA v. Singh et al,3:05-cr-00006,356,2008-10-29,2008-10-29,2008-10-29,,No,,,350000,358390,60,,708390,,,,,,,,,,,,,,,,,,,,,,,,,,,,,,,2008,PACER,
1624,Janco Composites Inc.,plea,Immigration,,Indiana - Northern District,United States,No,United States of America v. Janco Composites Inc et al,3:09-cr-00005,24,2009-04-23,2009-04-23,2009-01-27,,No,,,210000,,60,,210000,,,,,,,,,,,,,,,,,,,,,,,,,,,,,,,2009,PACER,
1625,Janitorial & Maintenance Service Corp.,plea,Fraud - General,,New Jersey,United States,No,USA v. Smith et al,2:01-cr-00046,29,2002-01-02,2002-01-02,2001-04-11,,No,,,0,,0,,0,,,,,,,,,,,,,,,,,,,,,,,,,,,,,,,2002,PACER,
1626,Janitorial Maintenance Inc.,plea,Immigration,,Georgia - Northern District,United States,No,USA v. Janitorial Maintenan,1:02-cr-00451,7,2002-07-30,2002-07-30,2002-07-26,,No,,,24000,,36,0,24000,,,,,,,,,,,,,,,,,,,,,,,,,,,,,,,2002,PACER,
1627,"Janssen Pharmaceuticals, Inc.",plea,FDCA / Pharma,,Pennsylvania - Eastern District,United States,No,"USA v. JANSSEN PHARMACEUTICALS, INC.",2:13-cr-00605,12,2013-11-07,2013-11-07,2013-11-07,,Yes,125,0,334000000,0,,0,334000000,,,,,,,,,,,,,,,,,,,,,,,,,,,,,,,2013,PACER,
354,Japan Airlines International Co. Ltd.,plea,Antitrust,,USDOJ - Antitrust Division,Japan,No,USA v. JAPAN AIRLINES INTERNATIONAL CO. LTD.,1:08-cr-00106,10,2008-05-07,2008-05-07,2008-05-07,,No,,,110000000,,0,,110000000,,,,,,,,,,,,,,,,,,,,,,,,,,,,,,,2008,PACER,
1628,Jax China Kings Inc.,plea,Immigration,,Florida - Middle District,United States,No,USA v. Jax China Kings Inc.,3:06-cr-00172,13,2006-11-30,2006-11-30,2006-06-07,,No,,,500,,0,0,500,,,,,,,,,,,,,,,,,,,,,,,,,,,,,,,2006,PACER,
696,Jazz Pharmaceuticals,NP,FDCA / Pharma,No,New York - Eastern District,United States,No,,,,2007-07-01,,,,Yes,12262078,,5000000,,,12262078,17262078,Yes,No,No,,,Corporate Integrity Agreement with HHS incorporated,Yes,No,Misbranded Drug Marketing,"$3,750,000 plus 4% interest civil settlement with United States and Medicaid Participating states","Yes; ""(a acceptance of responsibility as acknowledged herein; (b cooperation-to-date and agreement to continue to cooperate with the Investigative Entities; (c agreement to guarantee the payments set forth in paragraph 6 above; (d implementation of remedial measures as set forth in paragraph 7 above; (e agreement to enter into the CIA and comply with its provisions;.",Yes,No,"$17,262,078 ($12,262,078 in forfeited profits and $5 million in fines)",No,No,"Corp. Integrity Agmt., Settlement Agmt.",No,No,No,Yes; OIG-HHS (See Corporate Integrity Agreement),Yes,"Yes; Including review of alleged illegality, training, new code of conduct, Chief Compliance Officer appointed, replacing sales staff, Medical Affairs group",No,0,3750000,Dept. of Health & Human Services; Dept. of Veterans Affairs (VA); Dept. of Health & Human Services - Food & Drug Administration (FDA),No,3750000,No,2007,,"Illegal marketing activities conducted by Orphan Medical, Inc., which JPI acquired through merger in 2005. Criminal case against physician: U.S. v. Caronia, 576 F. Supp. 2d 385"
1629,Jefco International Inc.,plea,Other,,South Carolina,United States,No,USA v. Jefco International Inc,7:07-cr-00443,19,2007-10-29,2007-10-29,2007-10-29,,No,0,0,167059,0,60,101920,268979,,,,,,,,,,,,,,,,,,,,,,,,,,,,,,,2007,PACER,
758,Jefferies Group LLC,NP,Fraud - General,No,Connecticut,United States,Yes,,,,2014-01-29,,,JEF,Yes,0,0,25000000,0,12,0,25000000,,,,,,,,,,,,,,,,,,,,,,,,,,,,,,,2014,,
1630,Jemm Co.,plea,Environmental,,Colorado,United States,No,USA v. The Jemm Company et al,1:01-cr-00102,0,2002-05-03,,2002-05-03,,No,,,100000,,0,0,100000,,,,,,,,,,,,,,,,,,,,,,,,,,,,,,,2002,PACER,
697,Jenkins Gilchrist,NP,Fraud - Tax,No,New York - Southern District,United States,No,,,,2007-03-26,,,,No,0,,0,,,,0,No,No,No,"Yes (class action, Denney v. Jenkens & Gilchrist, 340 F. Supp. 2d, 443 F.3d 253, settlement); (RICO, Seippel v. Jenkens & Gilchrist, 341 F. Supp.2d 363, voluntarily dismissed against Jenkens & Gilchrist see 2004 WL 2809205); (fraud class action, Olson v. Jenkens & Gilchrist, 461 F. Supp. 2d 710, couldn't find how it ended)",75000000,"N/A; Its offices ""have already been or will soon be closed""",No,No,Tax fraud,,"Yes; noting cooperation, and imminent closure due to financial difficulties.",Yes,No,None,No,No,,No,No,Yes,Yes; IRS (pursuant to a closing agreement but couldn't find it),No,No; None noted,No,0,76000000,Dept. of the Treasury - Internal Revenue Service (IRS),No,76000000,No,2007,,
2828,Jenkins Spirits Corp. Ltd.,plea,Other,,New York - Northern District,United States,No,USA v. Jenkins Spirits Corp,5:00-cr-00042,7,2000-01-28,2000-01-28,2000-01-24,,No,,,100000,,,,100000,,,,,,,,,,,,,,,,,,,,,,,,,,,,,,,2000,PACER,
356,"Jerry's Metal Finishing, Inc.",plea,Environmental,,Missouri - Eastern District,United States,No,USA v. Jerry's Metal Finishing Inc,4:09-cr-00338,10,2009-06-12,2009-06-12,2009-06-12,,No,,,5000,,12,3292,8292,,,,,,,,,,,,,,,,,,,,,,,,,,,,,,,2009,PACER,
2829,Jersey Technology Laboratories Inc.,plea,Fraud - General,,New York - Northern District,United States,No,USA v. Jersey Technology,1:00-cr-00126,9,2000-09-14,2000-09-14,2000-03-15,,No,,,,,60,185884,185884,,,,,,,,,,,,,,,,,,,,,,,,,,,,,,,2000,PACER,
1631,Jet City Mortgage LLC,plea,Money Laundering,,Washington - Western District,United States,No,USA v. Jet City Mortgage LLC et al,2:09-cr-00107,25,2009-07-06,2009-07-06,2009-07-06,,No,0,0,307150,0,12,0,307150,,,,,,,,,,,,,,,,,,,,,,,,,,,,,,,2009,PACER,
1632,Jet-Pep Inc.,plea,False Statements,,Alabama - Northern District,United States,No,USA v. Jet-Pep Inc,5:03-cr-00127,8,2003-08-06,2003-08-06,2003-04-15,,No,,,200000,,36,,200000,,,,,,,,,,,,,,,,,,,,,,,,,,,,,,,2003,PACER,
1633,Jim's Water Service Inc.,plea,Wildlife,,Wyoming,United States,No,USA v. Jim's Water Service Inc,1:08-cr-00137,6,2008-08-07,2008-08-07,2008-06-17,,No,,,10000,,0,5000,15000,,,,,,,,,,,,,,,,,,,,,,,,,,,,,,,2008,PACER,
1634,Jo Tankers B.V.,plea,Antitrust,,USDOJ - Antitrust Division,Netherlands,No,USA v. JO TANKERS B.V.,2:04-cr-00221,17,2004-06-10,2004-06-10,2004-06-09,,No,,,19500000,,60,,19500000,,,,,,,,,,,,,,,,,,,,,,,,,,,,,,,2004,PACER,
1635,Jocel Manufacturing Corp.,plea,Fraud - General,,"Puerto Rico,USDOJ - Civil Division - Office of Consumer Litigation",United States,No,USA v. Jocel Manufacturing et al,3:00-cr-00078,108,2002-11-13,2002-11-13,2001-02-20,,No,,,20000,,0,0,20000,,,,,,,,,,,,,,,,,,,,,,,,,,,,,,,2002,PACER,
1636,Joe Christiana Food Distributors Inc.,plea,Food,,Louisiana - Middle District,United States,No,USA v. Joe Christiana Food Distributors Inc.,3:08-cr-00055,8,2009-09-04,2009-09-04,2008-07-23,,No,,,20000,,0,11529,31529,,,,,,,,,,,,,,,,,,,,,,,,,,,,,,,2009,PACER,
1637,Joe's Cajun Seafood Inc.,plea,Environmental,,Louisiana - Eastern District,United States,No,USA v. Joe's Cajun Seafood,2:02-cr-00134,18,2002-12-18,2002-12-18,2002-09-18,,No,,,35000,,60,15000,50000,,,,,,,,,,,,,,,,,,,,,,,,,,,,,,,2002,PACER,
1638,"Joel I Bernstein, M.D., INC.",plea,Fraud - Health Care,,California - Southern District,United States,No,"USA v. Bernstein, M.D., INC.",3:13-cr-00119,8,2013-07-01,2013-07-01,2013-01-23,,No,400,0,500000,0,12,1780155,2280155,,,,,,,,,,,,,,,,,,,,,,,,,,,,,,,2013,PACER,
1639,John Gibson Auto Sales Inc.,plea,Bank Secrecy Act,,Arizona,United States,No,USA v. John Gibson Auto Sales Inc.,6:11-CR-60030,15,2012-10-30,2012-10-30,2011-09-22,,No,,,0,,0,,0,,,,,,,,,,,,,,,,,,,,,,,,,,,,,,,2012,PACER,
2727,John Hancock Mutual Life,NP,Other,No,Massachusetts,United States,No,,,,1994-03-01,,,,No,,,,,,,0,,,,,,,,,,,,,,,,,,,,,,,,,,,,,,,1994,,
1640,Johnny F. Smith Trucking Co.,plea,Fraud - General,,North Carolina - Eastern District,United States,No,USA v. Johnny F. Smith Truc,5:01-cr-00189,8,2001-08-30,2001-08-30,2001-08-30,,No,,,1442900,,0,961933,2404833,,,,,,,,,,,,,,,,,,,,,,,,,,,,,,,2001,PACER,
605,Johnson & Johnson,DP,FCPA,No,USDOJ - Criminal Division - Fraud Section,United States,No,,,,2011-01-14,,,,Yes,0,,21400000,,36,,21400000,Yes,Yes; Chief Compliance Officer,No,"Shareholder derivative lawsuit claiming breach of fiduciary duty, failure to implement controls to prevent bribery",,Including periodic reviews and reports to DOJ(initial review + 5 follow-up reviews and reports); standard FCPA corporate compliance program; appoint Chief Compliance Officer; maintain a global compliance leadership team; new policies and procedures; reporting mechanisms; conduct risk assessments; periodic FCPA audits; training,Yes,No,FCPA,,"Yes; voluntary and timely disclosure, internal investigation, cooperation, remedial measures - ""J&J had a pre-existing compliance and ethics program that was effective and the majority of problematic operations globally resulted from insufficient implementation of the J&J compliance and ethics program in acquired companies."".",Yes; Provides for an extension of the term of the Agreement if violated for an additional year,Yes; 25% reduction below bottom of guidelines range,DePuy International Ltd. (subsidiary) settled corruption charges with U.K. SFO for ?4.829M,No,Yes; Risk assessments,,No,No,Yes,Yes; SEC,Yes,"Yes; ""significant remediation"" and global review of compliance policies; internal investigation",No,48666316,0,Securities and Exchange Commission (SEC); other - U.K. SFO,Yes,48666316,No,2011,,"Johnson & Johnson is parent company of DePuy, Inc. who commited the violations of FCPA. U.K. SFO Press Release: http://www.foley.com/files/DePuy_SFO_Release_18apr11.pdf - Greece also restrained 5.785M in DePuy's assets"
358,"Johnson Matthey, Inc.",plea,Environmental,,USDOJ - Environment & Natural Resources Division,United States,No,USA v. Johnson Matthey Inc.et al,2:06-cr-00169,152,2008-12-03,2008-12-03,2008-09-03,,Yes,,750000,2250000,,0,,3000000,,,,,,,,,,,,,,,,,,,,,,,,,,,,,,,2008,PACER,
2830,Johnson Properties Inc.,plea,Environmental,,USDOJ - Environment & Natural Resources Division,United States,No,USA v. Johnson et al,2:98-cr-00276,222,2000-01-28,2000-01-28,2000-01-13,,No,,,,,,,0,,,,,,,,,,,,,,,,,,,,,,,,,,,,,,,2000,PACER,
2831,Jolin Enterprises Inc.,plea,Wildlife,,South Carolina,United States,No,USA v. Jolin Enterprises,2:00-cr-00170,6,2000-03-27,2000-03-27,2000-03-23,,No,,30000,,,,,30000,,,,,,,,,,,,,,,,,,,,,,,,,,,,,,,2000,PACER,
1641,Jones Festus Development LLC,plea,Other,,Missouri - Eastern District,United States,No,USA v. Jones et al,4:06-cr-00261,20,2006-07-07,2006-07-07,2006-04-19,,No,,,0,,24,0,0,,,,,,,,,,,,,,,,,,,,,,,,,,,,,,,2006,PACER,
1642,Jones Island Club Inc.,plea,Other,,North Carolina - Eastern District,United States,No,USA v. Jones Island Club Inc.,4:06-mj-00049,6,2007-05-01,2007-05-01,2007-05-01,,No,0,0,25000,0,24,0,25000,,,,,,,,,,,,,,,,,,,,,,,,,,,,,,,2007,PACER,
359,Joseph Daniel Co.,plea,Fraud - General,,"Illinois - Southern District,Missouri - Eastern District",United States,No,USA v. Castellano et al,3:01-cr-30073,133,2003-01-30,2003-01-30,2002-10-11,,No,,,0,,60,1847964,1847964,,,,,,,,,,,,,,,,,,,,,,,,,,,,,,,2003,PACER,
360,Julie's Cafe,plea,Immigration,,Wisconsin - Eastern District,United States,No,USA v. Julie's Cafe LLC et al,1:05-cr-00120,27,2005-10-17,2005-10-17,2005-04-27,,No,,,20000,,60,,20000,,,,,,,,,,,,,,,,,,,,,,,,,,,,,,,2005,PACER,
1643,Jumbo Cargo Inc.,plea,Fraud - General,,Florida - Southern District,United States,No,USA v. Mehdi et al,1:09-cr-20852,292,2011-01-04,2011-01-04,2010-09-15,,No,,,0,,36,0,0,,,,,,,,,,,,,,,,,,,,,,,,,,,,,,,2011,PACER,
1644,Just For Me Inc.,plea,Money Laundering,,North Dakota,United States,No,USA v. Just for Me Inc.,4:07-cr-00015,12,2007-06-04,2007-06-04,2007-06-04,,No,0,0,0,65559,0,0,65559,,,,,,,,,,,,,,,,,,,,,,,,,,,,,,,2007,PACER,
137,K Line Logistics,plea,Antitrust,,District of Columbia,United States,No,"USA v. ""K"" LINE LOGISTICS, LTD",1:13-cr-00078,9,2013-09-04,2013-09-04,2013-08-22,,No,400,0,3507246,0,24,0,3507246,,,,,,,,,,,,,,,,,,,,,,,,,,,,,,,2013,PACER,
